<?xml version="1.0" encoding="UTF-8"?>

<xs:schema xmlns:xs="http://www.w3.org/2001/XMLSchema">
    <xs:element name="employee_info">
        <xs:complexType>
            <xs:sequence>
                <xs:element name="employee" maxOccurs="unbounded">
                    <xs:complexType>
                        <xs:sequence>
                            <xs:element name="Name" type="xs:string"></xs:element>
                            <xs:element name="Department" type="xs:string"></xs:element>
                            <xs:element name="telephone" type="xs:string"></xs:element>
                            <xs:element name="email" type="xs:string"></xs:element>
                        </xs:sequence>
                        <xs:attribute name="employee_number" type="xs:int"></xs:attribute>
                    </xs:complexType>
                </xs:element>
            </xs:sequence>
        </xs:complexType>
    </xs:element>
</xs:schema>